{"actor":{"heightM":1.75,"maximumSlopeDegrees":35,"maximumStepM":0.35,"radiusM":0.35},"coordinateReference":"route-local-enu-v1","edges":[{"evidenceClass":"derived","from":0,"lengthM":51.899472563548855,"surface":"route-ribbon","to":1},{"evidenceClass":"derived","from":1,"lengthM":59.41548711036437,"surface":"route-ribbon","to":2},{"evidenceClass":"derived","from":2,"lengthM":53.434198124270495,"surface":"route-ribbon","to":3},{"evidenceClass":"derived","from":3,"lengthM":51.34891872128736,"surface":"route-ribbon","to":4},{"evidenceClass":"derived","from":4,"lengthM":69.16354219365735,"surface":"route-ribbon","to":5},{"evidenceClass":"derived","from":5,"lengthM":57.56297129401935,"surface":"route-ribbon","to":6},{"evidenceClass":"derived","from":6,"lengthM":54.171023677944106,"surface":"route-ribbon","to":7},{"evidenceClass":"derived","from":7,"lengthM":60.63080933692021,"surface":"route-ribbon","to":8},{"evidenceClass":"derived","from":8,"lengthM":53.90476665001228,"surface":"route-ribbon","to":9},{"evidenceClass":"derived","from":9,"lengthM":69.0701865877615,"surface":"route-ribbon","to":10},{"evidenceClass":"derived","from":10,"lengthM":58.46724504136364,"surface":"route-ribbon","to":11},{"evidenceClass":"derived","from":11,"lengthM":52.14174154675504,"surface":"route-ribbon","to":12},{"evidenceClass":"derived","from":12,"lengthM":57.67256991687918,"surface":"route-ribbon","to":13},{"evidenceClass":"derived","from":13,"lengthM":56.65819910289861,"surface":"route-ribbon","to":14},{"evidenceClass":"derived","from":14,"lengthM":50.1460314498662,"surface":"route-ribbon","to":15},{"evidenceClass":"derived","from":15,"lengthM":56.758310990089626,"surface":"route-ribbon","to":16},{"evidenceClass":"derived","from":16,"lengthM":56.841830030482015,"surface":"route-ribbon","to":17},{"evidenceClass":"derived","from":17,"lengthM":50.142045182665356,"surface":"route-ribbon","to":18},{"evidenceClass":"derived","from":18,"lengthM":52.32406534785673,"surface":"route-ribbon","to":19},{"evidenceClass":"derived","from":19,"lengthM":63.96502643124609,"surface":"route-ribbon","to":20},{"evidenceClass":"derived","from":20,"lengthM":50.31410790176096,"surface":"route-ribbon","to":21},{"evidenceClass":"derived","from":21,"lengthM":65.14758663508633,"surface":"route-ribbon","to":22},{"evidenceClass":"derived","from":22,"lengthM":61.29091776586051,"surface":"route-ribbon","to":23},{"evidenceClass":"derived","from":23,"lengthM":59.569419914679656,"surface":"route-ribbon","to":24},{"evidenceClass":"derived","from":24,"lengthM":63.02634661004981,"surface":"route-ribbon","to":25},{"evidenceClass":"derived","from":25,"lengthM":53.425004318827405,"surface":"route-ribbon","to":26},{"evidenceClass":"derived","from":26,"lengthM":57.447066554475896,"surface":"route-ribbon","to":27},{"evidenceClass":"derived","from":27,"lengthM":67.87835601190363,"surface":"route-ribbon","to":28},{"evidenceClass":"derived","from":28,"lengthM":55.52318390908454,"surface":"route-ribbon","to":29},{"evidenceClass":"derived","from":29,"lengthM":57.08619134651963,"surface":"route-ribbon","to":30},{"evidenceClass":"derived","from":30,"lengthM":58.108343014704815,"surface":"route-ribbon","to":31},{"evidenceClass":"derived","from":31,"lengthM":60.298140139680754,"surface":"route-ribbon","to":32},{"evidenceClass":"derived","from":32,"lengthM":56.18966977222544,"surface":"route-ribbon","to":33},{"evidenceClass":"derived","from":33,"lengthM":54.7112344973948,"surface":"route-ribbon","to":34},{"evidenceClass":"derived","from":34,"lengthM":54.150610945683866,"surface":"route-ribbon","to":35},{"evidenceClass":"derived","from":35,"lengthM":64.77525158427193,"surface":"route-ribbon","to":36},{"evidenceClass":"derived","from":36,"lengthM":50.7180664167131,"surface":"route-ribbon","to":37},{"evidenceClass":"derived","from":37,"lengthM":53.645015369418616,"surface":"route-ribbon","to":38},{"evidenceClass":"derived","from":38,"lengthM":51.27872885118859,"surface":"route-ribbon","to":39},{"evidenceClass":"derived","from":39,"lengthM":52.2410234903723,"surface":"route-ribbon","to":40},{"evidenceClass":"derived","from":40,"lengthM":50.34876922267813,"surface":"route-ribbon","to":41},{"evidenceClass":"derived","from":41,"lengthM":67.9035334080404,"surface":"route-ribbon","to":42},{"evidenceClass":"derived","from":42,"lengthM":54.05530073775935,"surface":"route-ribbon","to":43},{"evidenceClass":"derived","from":43,"lengthM":55.85970361523323,"surface":"route-ribbon","to":44},{"evidenceClass":"derived","from":44,"lengthM":63.65115269732314,"surface":"route-ribbon","to":45},{"evidenceClass":"derived","from":45,"lengthM":52.44776489921651,"surface":"route-ribbon","to":46},{"evidenceClass":"derived","from":46,"lengthM":54.152729507015465,"surface":"route-ribbon","to":47},{"evidenceClass":"derived","from":47,"lengthM":53.969781429269005,"surface":"route-ribbon","to":48},{"evidenceClass":"derived","from":48,"lengthM":52.916200645436675,"surface":"route-ribbon","to":49},{"evidenceClass":"derived","from":49,"lengthM":67.43499585262725,"surface":"route-ribbon","to":50},{"evidenceClass":"derived","from":50,"lengthM":55.90430087623372,"surface":"route-ribbon","to":51},{"evidenceClass":"derived","from":51,"lengthM":57.72525725001515,"surface":"route-ribbon","to":52},{"evidenceClass":"derived","from":52,"lengthM":59.595903467541575,"surface":"route-ribbon","to":53},{"evidenceClass":"derived","from":53,"lengthM":53.149701929663934,"surface":"route-ribbon","to":54},{"evidenceClass":"derived","from":54,"lengthM":51.4854417729739,"surface":"route-ribbon","to":55},{"evidenceClass":"derived","from":55,"lengthM":69.42425720850042,"surface":"route-ribbon","to":56},{"evidenceClass":"derived","from":56,"lengthM":55.18192532303328,"surface":"route-ribbon","to":57},{"evidenceClass":"derived","from":57,"lengthM":67.72224540589741,"surface":"route-ribbon","to":58},{"evidenceClass":"derived","from":58,"lengthM":58.72744240440716,"surface":"route-ribbon","to":59},{"evidenceClass":"derived","from":59,"lengthM":67.72016416534098,"surface":"route-ribbon","to":60},{"evidenceClass":"derived","from":60,"lengthM":50.69871854935582,"surface":"route-ribbon","to":61},{"evidenceClass":"derived","from":61,"lengthM":56.97157498971865,"surface":"route-ribbon","to":62},{"evidenceClass":"derived","from":62,"lengthM":63.427161439645715,"surface":"route-ribbon","to":63},{"evidenceClass":"derived","from":63,"lengthM":54.28649109797334,"surface":"route-ribbon","to":64},{"evidenceClass":"derived","from":64,"lengthM":56.920776640629356,"surface":"route-ribbon","to":65},{"evidenceClass":"derived","from":65,"lengthM":55.61031542890623,"surface":"route-ribbon","to":66},{"evidenceClass":"derived","from":66,"lengthM":68.24796540086572,"surface":"route-ribbon","to":67},{"evidenceClass":"derived","from":67,"lengthM":51.3358426062473,"surface":"route-ribbon","to":68},{"evidenceClass":"derived","from":68,"lengthM":52.090341562022786,"surface":"route-ribbon","to":69},{"evidenceClass":"derived","from":69,"lengthM":52.98266527541591,"surface":"route-ribbon","to":70},{"evidenceClass":"derived","from":70,"lengthM":57.52184368687767,"surface":"route-ribbon","to":71},{"evidenceClass":"derived","from":71,"lengthM":55.394732163468234,"surface":"route-ribbon","to":72},{"evidenceClass":"derived","from":72,"lengthM":65.948519862367,"surface":"route-ribbon","to":73},{"evidenceClass":"derived","from":73,"lengthM":64.33134688376776,"surface":"route-ribbon","to":74},{"evidenceClass":"derived","from":74,"lengthM":63.53317213015907,"surface":"route-ribbon","to":75},{"evidenceClass":"derived","from":75,"lengthM":51.40923580375147,"surface":"route-ribbon","to":76},{"evidenceClass":"derived","from":76,"lengthM":60.75395926629881,"surface":"route-ribbon","to":77},{"evidenceClass":"derived","from":77,"lengthM":57.75605617442943,"surface":"route-ribbon","to":78},{"evidenceClass":"derived","from":78,"lengthM":66.83823918738108,"surface":"route-ribbon","to":79},{"evidenceClass":"derived","from":79,"lengthM":63.99238430668174,"surface":"route-ribbon","to":80},{"evidenceClass":"derived","from":80,"lengthM":58.40603131748594,"surface":"route-ribbon","to":81},{"evidenceClass":"derived","from":81,"lengthM":56.88619590132748,"surface":"route-ribbon","to":82},{"evidenceClass":"derived","from":82,"lengthM":71.5325780440362,"surface":"route-ribbon","to":83},{"evidenceClass":"derived","from":83,"lengthM":61.594308250444556,"surface":"route-ribbon","to":84},{"evidenceClass":"derived","from":84,"lengthM":56.17267153254306,"surface":"route-ribbon","to":85},{"evidenceClass":"derived","from":85,"lengthM":53.03996743785501,"surface":"route-ribbon","to":86},{"evidenceClass":"derived","from":86,"lengthM":68.8459964228241,"surface":"route-ribbon","to":87},{"evidenceClass":"derived","from":87,"lengthM":56.13365436788081,"surface":"route-ribbon","to":88},{"evidenceClass":"derived","from":88,"lengthM":51.00452211797983,"surface":"route-ribbon","to":89},{"evidenceClass":"derived","from":89,"lengthM":56.99276169165478,"surface":"route-ribbon","to":90},{"evidenceClass":"derived","from":90,"lengthM":62.35830443206123,"surface":"route-ribbon","to":91},{"evidenceClass":"derived","from":91,"lengthM":62.77781034945292,"surface":"route-ribbon","to":92},{"evidenceClass":"derived","from":92,"lengthM":54.675250741939635,"surface":"route-ribbon","to":93},{"evidenceClass":"derived","from":93,"lengthM":52.81517213506413,"surface":"route-ribbon","to":94},{"evidenceClass":"derived","from":94,"lengthM":69.49534921363738,"surface":"route-ribbon","to":95},{"evidenceClass":"derived","from":95,"lengthM":53.952762891241946,"surface":"route-ribbon","to":96},{"evidenceClass":"derived","from":96,"lengthM":59.884363055932226,"surface":"route-ribbon","to":97},{"evidenceClass":"derived","from":97,"lengthM":56.82146789866874,"surface":"route-ribbon","to":98},{"evidenceClass":"derived","from":98,"lengthM":53.92025047836887,"surface":"route-ribbon","to":99},{"evidenceClass":"derived","from":99,"lengthM":52.87762075489718,"